{
  "$schema": "http://json-schema.org/draft-07/schema#",
  "title": "WZRD Studio plugin manifest",
  "type": "object",
  "additionalProperties": false,
  "required": ["name", "version", "description", "mcp", "skills"],
  "properties": {
    "$schema": { "type": "string" },
    "name": { "type": "string", "pattern": "^[a-z0-9]+(-[a-z0-9]+)*$", "maxLength": 64 },
    "version": { "type": "string", "pattern": "^\\d+\\.\\d+\\.\\d+$" },
    "description": { "type": "string", "maxLength": 1024 },
    "homepage": { "type": "string" },
    "license": { "type": "string" },
    "author": {
      "type": "object",
      "additionalProperties": false,
      "properties": {
        "name": { "type": "string" },
        "url": { "type": "string" },
        "email": { "type": "string" }
      }
    },
    "mcp": { "type": "string" },
    "skills": { "type": "string" },
    "clients": {
      "type": "object",
      "additionalProperties": { "type": "string" }
    }
  }
}
