{
  "$schema": "./schema/plugin.schema.json",
  "name": "wzrd-studio",
  "version": "1.1.0",
  "description": "WZRD Studio universal plugin: storyboard, generate, and export AI film projects from any MCP-capable agent, with credit-safe spending.",
  "homepage": "https://studio.wzrd.tech",
  "license": "SEE LICENSE IN README.md",
  "author": {
    "name": "WZRD Studio",
    "url": "https://studio.wzrd.tech"
  },
  "mcp": "./mcp.json",
  "skills": "./skills",
  "clients": {
    "claude-code": "../.claude-plugin",
    "codex": "../com.openai.codex",
    "openclaw": "../ai.openclaw",
    "hermes": "../com.hermes"
  }
}
